{
  "id": "0b9f6c1e-3d2a-4f7b-9c1e-5a6b7c8d9e0f",
  "email_address": "admin@curitiba.demo",
  "mfa_enrolled": true,
  "operator": false,
  "mfa_verified_at": "2026-10-05T14:03:00Z",
  "memberships": [
    {
      "city_slug": "curitiba",
      "city_name": "Curitiba",
      "city_uf": "PR",
      "role": "municipal_admin"
    }
  ],
  "time_zone": "America/Sao_Paulo",
  "features": []
}
